{
  "$schema": "http://json-schema.org/draft-07/schema#",
  "$ref": "#/definitions/Space",
  "definitions": {
    "Space": {
      "title": "Space",
      "type": "object",
      "properties": {
        "name": {
          "type": "string",
          "title": "name",
          "minLength": 1,
          "maxLength": 32
        },
        "private": {
          "type": "boolean"
        },
        "about": {
          "type": "string",
          "title": "about",
          "maxLength": 160
        },
        "guidelines": {
          "type": "string",
          "format": "customUrl",
          "title": "guidelines",
          "maxLength": 256
        },
        "template": {
          "type": "string",
          "title": "template",
          "maxLength": 1024
        },
        "terms": {
          "type": "string",
          "title": "terms",
          "format": "customUrl",
          "maxLength": 256
        },
        "avatar": {
          "type": "string",
          "title": "avatar",
          "format": "customUrl",
          "maxLength": 256
        },
        "cover": {
          "type": "string",
          "title": "avatar",
          "format": "customUrl",
          "maxLength": 256
        },
        "location": {
          "type": "string",
          "title": "location",
          "maxLength": 24
        },
        "website": {
          "type": "string",
          "title": "website",
          "format": "customUrl",
          "maxLength": 256
        },
        "twitter": {
          "type": "string",
          "title": "twitter",
          "pattern": "^[A-Za-z0-9_]*$",
          "maxLength": 15
        },
        "coingecko": {
          "type": "string",
          "title": "coingecko",
          "pattern": "^[a-z0-9-]*$",
          "maxLength": 32
        },
        "github": {
          "type": "string",
          "title": "github",
          "pattern": "^[A-Za-z0-9_-]*$",
          "maxLength": 39
        },
        "email": {
          "type": "string",
          "title": "email",
          "maxLength": 32
        },
        "network": {
          "type": "string",
          "snapshotNetwork": true,
          "title": "network",
          "minLength": 1,
          "maxLength": 32
        },
        "symbol": {
          "type": "string",
          "title": "symbol",
          "maxLength": 16
        },
        "skin": {
          "type": "string",
          "title": "skin",
          "maxLength": 32
        },
        "domain": {
          "type": "string",
          "title": "domain",
          "maxLength": 64,
          "format": "domain"
        },
        "discussions": {
          "type": "string",
          "format": "uri",
          "title": "Discussions link",
          "maxLength": 256
        },
        "discourseCategory": {
          "type": "integer",
          "minimum": 1,
          "title": "Discourse category"
        },
        "strategies": {
          "type": "array",
          "minItems": 1,
          "uniqueItems": true,
          "items": {
            "type": "object",
            "properties": {
              "name": {
                "type": "string",
                "maxLength": 64,
                "title": "name"
              },
              "network": {
                "type": "string",
                "maxLength": 12,
                "title": "network",
                "snapshotNetwork": true
              },
              "params": {
                "type": "object",
                "title": "params"
              }
            },
            "required": ["name"],
            "additionalProperties": false
          },
          "title": "strategies"
        },
        "members": {
          "type": "array",
          "maxItems": 100,
          "items": {
            "type": "string",
            "anyOf": [
              { "format": "evmAddress" },
              { "format": "starknetAddress" }
            ],
            "errorMessage": "Must be a valid address"
          },
          "title": "members",
          "uniqueItems": true
        },
        "admins": {
          "type": "array",
          "maxItems": 100,
          "items": {
            "type": "string",
            "anyOf": [
              { "format": "evmAddress" },
              { "format": "starknetAddress" }
            ],
            "errorMessage": "Must be a valid address"
          },
          "title": "admins",
          "uniqueItems": true
        },
        "moderators": {
          "type": "array",
          "maxItems": 100,
          "items": {
            "type": "string",
            "anyOf": [
              { "format": "evmAddress" },
              { "format": "starknetAddress" }
            ],
            "errorMessage": "Must be a valid address"
          },
          "title": "moderators",
          "uniqueItems": true
        },
        "filters": {
          "type": "object",
          "properties": {
            "defaultTab": {
              "type": "string"
            },
            "minScore": {
              "type": "number",
              "minimum": 0
            },
            "onlyMembers": {
              "type": "boolean"
            },
            "invalids": {
              "type": "array",
              "items": {
                "type": "string",
                "maxLength": 64
              },
              "title": "invalids"
            }
          },
          "additionalProperties": false
        },
        "validation": {
          "type": "object",
          "properties": {
            "name": {
              "type": "string",
              "maxLength": 64,
              "title": "name"
            },
            "params": {
              "type": "object",
              "title": "params"
            }
          },
          "required": ["name"],
          "additionalProperties": false
        },
        "voteValidation": {
          "type": "object",
          "properties": {
            "name": {
              "type": "string",
              "maxLength": 32,
              "title": "name"
            },
            "params": {
              "type": "object",
              "title": "params"
            }
          },
          "required": ["name"],
          "additionalProperties": false
        },
        "followValidation": {
          "type": "object",
          "properties": {
            "name": {
              "type": "string",
              "maxLength": 32,
              "title": "name"
            },
            "params": {
              "type": "object",
              "title": "params"
            }
          },
          "required": ["name"],
          "additionalProperties": false
        },
        "delegationPortal": {
          "type": "object",
          "properties": {
            "delegationType": {
              "type": "string",
              "title": "Delegation type",
              "description": "Specify the type of delegation that you are using",
              "anyOf": [
                { "const": "compound-governor", "title": "Compound governor" },
                { "const": "split-delegation", "title": "Split Delegation" }
              ]
            },
            "delegationContract": {
              "type": "string",
              "title": "Contract address",
              "description": "The address of your delegation contract",
              "examples": ["0x3901D0fDe202aF1427216b79f5243f8A022d68cf"],
              "anyOf": [
                { "format": "evmAddress" },
                { "format": "starknetAddress" }
              ],
              "errorMessage": "Must be a valid EVM of Starknet address"
            },
            "delegationNetwork": {
              "type": "string",
              "title": "Delegation network",
              "description": "The network of your delegation contract",
              "anyOf": [
                { "snapshotNetwork": true },
                { "starknetNetwork": true }
              ],
              "errorMessage": "Must be a valid network"
            },
            "delegationApi": {
              "type": "string",
              "format": "uri",
              "title": "Delegation API",
              "description": "The URL of your delegation API (e.g a subgraph)",
              "examples": [
                "https://subgrapher.snapshot.org/subgraph/arbitrum/FTzC6VrZd8JhJgWfTJnwWgH1Z1dS3GxaosKkRbCqkZAZ"
              ]
            }
          },
          "required": ["delegationType", "delegationApi", "delegationContract"],
          "additionalProperties": false
        },
        "allowAlias": {
          "type": "boolean"
        },
        "plugins": {
          "type": "object"
        },
        "voting": {
          "type": "object",
          "properties": {
            "delay": {
              "type": "integer",
              "minimum": 0,
              "maximum": 2592000,
              "errorMessage": {
                "maximum": "Delay must be less than 30 days"
              }
            },
            "period": {
              "type": "integer",
              "minimum": 0,
              "maximum": 31622400,
              "errorMessage": {
                "maximum": "Delay must be less than a year"
              }
            },
            "type": {
              "type": "string",
              "title": "type"
            },
            "quorum": {
              "type": "number",
              "minimum": 0
            },
            "quorumType": {
              "type": "string",
              "enum": ["rejection"]
            },
            "blind": {
              "type": "boolean"
            },
            "hideAbstain": {
              "type": "boolean"
            },
            "aliased": {
              "type": "boolean"
            },
            "privacy": {
              "type": "string",
              "enum": ["", "shutter", "any"]
            }
          },
          "additionalProperties": false
        },
        "categories": {
          "type": "array",
          "maxItems": 2,
          "items": {
            "type": "string",
            "enum": [
              "protocol",
              "social",
              "investment",
              "grant",
              "service",
              "media",
              "creator",
              "collector",
              "ai-agent",
              "gaming",
              "wallet",
              "music",
              "layer-2",
              "defai",
              "defi",
              "rwa",
              "depin",
              "meme"
            ]
          }
        },
        "treasuries": {
          "type": "array",
          "maxItems": 10,
          "uniqueItems": true,
          "items": {
            "type": "object",
            "properties": {
              "name": {
                "type": "string",
                "title": "Name",
                "examples": ["e.g. Balancer DAO 1"],
                "minLength": 1,
                "maxLength": 64
              },
              "address": {
                "type": "string",
                "title": "Contract address",
                "examples": ["e.g. 0x1f9840a85d5aF5bf1D1762F925BDADdC4201F984"],
                "anyOf": [
                  { "format": "evmAddress" },
                  { "format": "starknetAddress" }
                ],
                "errorMessage": "Must be a valid EVM of Starknet address"
              },
              "network": {
                "type": "string",
                "title": "Network",
                "anyOf": [
                { "snapshotNetwork": true },
                { "starknetNetwork": true }
              ],
              "errorMessage": "Must be a valid network"
              }
            },
            "required": ["name", "address", "network"],
            "additionalProperties": false
          }
        },
        "labels": {
          "type": "array",
          "maxItems": 10,
          "uniqueItems": true,
          "items":{
            "type": "object",
            "properties": {
              "id":{
                "type": "string",
                "title": "Id",
                "minLength": 1,
                "maxLength": 8
              },
              "name": {
                "type": "string",
                "title": "Name",
                "minLength": 1,
                "maxLength": 32
              },
              "description": {
                "type": "string",
                "title": "Description",
                "maxLength": 100
              },
              "color": {
                "type": "string",
                "title": "Color",
                "format": "color"
              }
            },
            "required": ["id", "name", "color"],
            "additionalProperties": false
          }
        },
        "parent": {
          "type": "string",
          "title": "parent"
        },
        "children": {
          "type": "array",
          "maxItems": 16,
          "title": "children",
          "items": {
            "type": "string"
          },
          "uniqueItems": true
        },
        "boost": {
          "type": "object",
          "properties": {
            "enabled": {
              "type": "boolean"
            },
            "bribeEnabled": {
              "type": "boolean"
            }
          },
          "required": ["enabled", "bribeEnabled"],
          "additionalProperties": false
        },
        "skinSettings": {
          "type": "object",
          "properties": {
            "bg_color": {
              "type": "string",
              "format": "color"
            },
            "link_color": {
              "type": "string",
              "format": "color"
            },
            "text_color": {
              "type": "string",
              "format": "color"
            },
            "content_color": {
              "type": "string",
              "format": "color"
            },
            "border_color" : {
              "type": "string",
              "format": "color"
            },
            "heading_color" : {
              "type": "string",
             "format": "color"
            },
            "primary_color": {
              "type": "string",
              "format": "color"
            },
            "header_color": {
              "type": "string",
              "format": "color"
            },
            "theme": {
              "type": "string",
              "enum": ["light", "dark"]
            },
            "logo": {
              "type": "string",
              "title": "logo",
              "format": "customUrl",
              "maxLength": 256
            }
          },
          "additionalProperties": false
        }
      },
      "required": ["name", "network", "strategies"],
      "additionalProperties": false
    }
  }
}
